{
  "schema": "swse.vehicle.sotg.cp20.source-fidelity-batch05.v1",
  "book": "Starships of the Galaxy",
  "sha256": "e4db33bea7d6c0cdd359870a6fc4f5a546ee9cefb25f964cd0e16a2c94e18bb0",
  "policyId": "SOTG-CP18-D01",
  "branch": "audit/sotg-strict-certification-cp17",
  "authorityBlobs": {
    "l": {
      "path": "data/audits/vehicles/swse-phase2b-sotg-cp16-per-entry-certification-ledger.json",
      "sha": "d08ca75b0b30e8b44896588edf3c5ce1cd335557"
    },
    "q": {
      "path": "data/audits/vehicles/swse-phase2b-sotg-cp17-strict-certification-work-queue.json",
      "sha": "9c7df34eefa54f456721ee18c6ee684ec214dbf6"
    },
    "o": {
      "path": "data/audits/vehicles/swse-phase2c-sotg-cp18-evidence-observation-overlay.json",
      "sha": "18b5df47516543e0646377b9eef71e4ef272026d"
    },
    "t": {
      "path": "data/audits/vehicles/swse-phase2b-sotg-cp19-tranche06-primary-source-review.json",
      "sha": "e5c92e09837ae7edb0f3d8292debaa9fc97364c5"
    },
    "c": {
      "path": "data/audits/vehicles/swse-sotg-cp20-controlled-source-corrections.json",
      "sha": "eba65c4857d6fb79c5dc49a780dd2280dd59d89b"
    },
    "prior": {
      "path": "data/audits/vehicles/swse-sotg-cp20-tranche04-source-fidelity-certificates.json",
      "sha": "7d660f044d85482cf3635ac1051a352f5e1aebe4"
    },
    "s": {
      "path": "data/audits/vehicles/swse-sotg-cp20-source-fidelity-tranche04.schema.json",
      "sha": "79ec172eed3c5c8ee066482214d5f1c363146002"
    }
  },
  "correctionPath": "data/audits/vehicles/swse-sotg-cp20-controlled-source-corrections.json",
  "tranche": {
    "queueFrom": 76,
    "queueTo": 90,
    "count": 15
  },
  "counts": {
    "newSourceFidelityCertificates": 15,
    "remainingSourceFidelityUncertified": 25,
    "unchangedStrictMechanicalBacklog": 100,
    "unchangedPriorPhysicalStrictCertificates": 4,
    "brandNewPhysicalMountCertificates": 0,
    "newAutomatedStockAttackPermissions": 0,
    "provenanceRestoredWithoutMutatingOldLedger": 0
  },
  "certificates": [
    {
      "certificateId": "SOTG-SF-CP20-T05-001",
      "queuePosition": 76,
      "cp16Index": 76,
      "sourceEntryKey": "sotg-fondor-shipyards-super-star-destroyer",
      "printedName": "Fondor Shipyards Super Star Destroyer",
      "printedStartPage": 136,
      "reviewedSourcePages": [
        136,
        137
      ],
      "originalFieldStates": {
        "printedTypeLine": "PDF_VERIFIED",
        "challenge": "PDF_VERIFIED",
        "initiativeSenses": "PDF_VERIFIED",
        "defenses": "PDF_VERIFIED",
        "durability": "PDF_VERIFIED",
        "speed": "PDF_VERIFIED",
        "rangedAttack": "PDF_VERIFIED",
        "meleeAttack": "PDF_VERIFIED",
        "fightingSpace": "PDF_VERIFIED",
        "baseAttack": "PDF_VERIFIED",
        "attackOptions": "PDF_VERIFIED",
        "abilities": "PDF_VERIFIED",
        "skills": "PDF_VERIFIED",
        "crew": "PDF_VERIFIED",
        "capacity": "PDF_VERIFIED",
        "payload": "PDF_VERIFIED",
        "hyperdrive": "PDF_VERIFIED",
        "cost": "PDF_VERIFIED",
        "weaponAttackProfile": "PDF_VERIFIED"
      },
      "publishedFacts": {
        "type": "Colossal (station) space station [printed]",
        "cl": 40,
        "initiative": -4,
        "sensesPerception": 6,
        "defenses": {
          "reflex": 18,
          "flatFootedReflex": 18,
          "fortitude": 74,
          "armorBonus": 18,
          "damageReduction": 20,
          "shieldRating": 400,
          "vehicularCombat": "printed"
        },
        "durability": {
          "hitPoints": 3000,
          "threshold": 574
        },
        "movement": {
          "starshipScale": {
            "mode": "fly",
            "squares": 1
          }
        },
        "fightingSpace": {
          "starshipScaleSquares": "2x2",
          "cover": "total"
        },
        "combat": {
          "baseAttackBonus": 2,
          "grappleBonus": 86,
          "ranged": "25 heavy turbolaser batteries +15* AND 25 turbolaser batteries +15* AND 25 heavy ion cannon batteries +15* AND 8 tractor beam batteries +15* AND 25 heavy concussion missile batteries +15*"
        },
        "abilities": {
          "str": 138,
          "dex": 10,
          "con": "-",
          "int": 20
        },
        "skills": {
          "initiative": -4,
          "mechanics": 6,
          "perception": 6,
          "pilot": -4,
          "useComputer": 6
        },
        "crew": {
          "count": 280734,
          "quality": "skilled"
        },
        "passengers": "38000 troops",
        "cargo": {
          "number": 250000,
          "unit": "tons"
        },
        "consumables": "6 years",
        "carriedCraft": "144 starfighters, support craft",
        "hyperspace": {
          "hyperdrive": "x2",
          "backup": "x10",
          "navcomputer": "printed"
        },
        "economics": {
          "availability": "Military",
          "newCredits": "not available for sale"
        },
        "payload": {
          "count": 50000,
          "type": "heavy concussion missiles"
        },
        "specialDefensesOrRules": {
          "tacticalFire": {
            "action": "standard, forgo all attacks",
            "radiusSquares": 3,
            "effect": "allies gain +1 attack and +1 damage die on successful attacks"
          }
        }
      },
      "originalAttackGroupObservations": [
        {
          "weaponLabel": "heavy turbolaser battery",
          "station": "battery (5 gunners)",
          "attackBonus": 15,
          "damage": "11d10x5",
          "sourcePage": 136,
          "hardwareCount": "SOURCE_SILENT_CONFIRMED",
          "firingArc": "SOURCE_SILENT_CONFIRMED",
          "batteryCount": 25,
          "againstSmallerThanColossal": -5
        },
        {
          "weaponLabel": "turbolaser battery",
          "station": "battery (5 gunners)",
          "attackBonus": 15,
          "damage": "8d10x5",
          "sourcePage": 136,
          "hardwareCount": "SOURCE_SILENT_CONFIRMED",
          "firingArc": "SOURCE_SILENT_CONFIRMED",
          "batteryCount": 25,
          "againstSmallerThanColossal": -5
        },
        {
          "weaponLabel": "heavy ion cannon battery",
          "station": "battery (5 gunners)",
          "attackBonus": 15,
          "damage": "5d10x5 ion",
          "sourcePage": 136,
          "hardwareCount": "SOURCE_SILENT_CONFIRMED",
          "firingArc": "SOURCE_SILENT_CONFIRMED",
          "batteryCount": 25,
          "againstSmallerThanColossal": -5
        },
        {
          "weaponLabel": "tractor beam battery",
          "station": "battery (5 gunners)",
          "attackBonus": 15,
          "damage": "- (grapple +86)",
          "sourcePage": 136,
          "hardwareCount": "SOURCE_SILENT_CONFIRMED",
          "firingArc": "SOURCE_SILENT_CONFIRMED",
          "batteryCount": 8,
          "againstSmallerThanColossal": -5
        },
        {
          "weaponLabel": "heavy concussion missile battery",
          "station": "battery (5 gunners)",
          "attackBonus": 15,
          "damage": "10d10x5",
          "sourcePage": 136,
          "hardwareCount": "SOURCE_SILENT_CONFIRMED",
          "firingArc": "SOURCE_SILENT_CONFIRMED",
          "batteryCount": 25,
          "againstSmallerThanColossal": -5,
          "splash": "4-square",
          "payload": 50000
        }
      ],
      "certifiedAttackGroupObservations": [
        {
          "weaponLabel": "heavy turbolaser battery",
          "station": "battery (5 gunners)",
          "attackBonus": 15,
          "damage": "11d10x5",
          "sourcePage": 136,
          "hardwareCount": "SOURCE_SILENT_CONFIRMED",
          "firingArc": "SOURCE_SILENT_CONFIRMED",
          "batteryCount": 25,
          "againstSmallerThanColossal": -5
        },
        {
          "weaponLabel": "turbolaser battery",
          "station": "battery (5 gunners)",
          "attackBonus": 15,
          "damage": "8d10x5",
          "sourcePage": 136,
          "hardwareCount": "SOURCE_SILENT_CONFIRMED",
          "firingArc": "SOURCE_SILENT_CONFIRMED",
          "batteryCount": 25,
          "againstSmallerThanColossal": -5
        },
        {
          "weaponLabel": "heavy ion cannon battery",
          "station": "battery (5 gunners)",
          "attackBonus": 15,
          "damage": "5d10x5 ion",
          "sourcePage": 136,
          "hardwareCount": "SOURCE_SILENT_CONFIRMED",
          "firingArc": "SOURCE_SILENT_CONFIRMED",
          "batteryCount": 25,
          "againstSmallerThanColossal": -5
        },
        {
          "weaponLabel": "tractor beam battery",
          "station": "battery (5 gunners)",
          "attackBonus": 15,
          "damage": "- (grapple +86)",
          "sourcePage": 136,
          "hardwareCount": "SOURCE_SILENT_CONFIRMED",
          "firingArc": "SOURCE_SILENT_CONFIRMED",
          "batteryCount": 8,
          "againstSmallerThanColossal": -5
        },
        {
          "weaponLabel": "heavy concussion missile battery",
          "station": "battery (5 gunners)",
          "attackBonus": 15,
          "damage": "10d10x5",
          "sourcePage": 136,
          "hardwareCount": "SOURCE_SILENT_CONFIRMED",
          "firingArc": "SOURCE_SILENT_CONFIRMED",
          "batteryCount": 25,
          "againstSmallerThanColossal": -5,
          "splash": "4-square",
          "payload": 50000
        }
      ],
      "configurationRuleEvidence": [
        {
          "type": "SUPER_CLASS_PRINTED_STATION_TYPE",
          "status": "PDF_VERIFIED",
          "finding": "Printed statblock is Colossal (station) space station with fly 1: preserve type line while recognizing narrative description of mobile star dreadnaught; do not normalize the type silently.",
          "sourcePrintedPage": 136
        },
        {
          "type": "EXECUTOR_BASELINE_AND_NAMED_VARIANTS",
          "status": "PDF_VERIFIED",